Issue key,Issue id,Parent id,Issue Type,Summary,Assignee,Reporter,Priority,Status,Resolution,Created,Updated,Due Date,Labels,Labels,Labels,Custom field (Resolution.)
OSSSUP-83690,1654912,,Scratch installation,Clab3417 need to install SP1903 P8,,xuazhao,Minor,Resolved,Closed,4.4.2019 9:39,4.4.2019 10:32,,,,,
OSSSUP-83689,1654908,,Other,LeftShift: SprintLab592: NeVe_Integrate_DisIntegrate_NE: Opening NetAct startpage failed 5 times,,viyou,Critical,Closed,Won't Fix,4.4.2019 9:37,10.4.2019 9:33,,,,,
OSSSUP-83688,1654737,,Unplanned SW upgrade,Upgrage CLAB3007 with SP577 v21,magrocho,dporebsk,Minor,Closed,Fixed,3.4.2019 21:47,4.4.2019 15:27,,,,,
OSSSUP-83687,1654687,,Scratch installation,Installation VSP0026 for SRAN19A,vt,lstratul,Minor,Closed,Fixed,3.4.2019 20:58,10.4.2019 15:06,,,,,
OSSSUP-83686,1654648,,Unplanned SW upgrade,[clab3011][coop] SP1902 installation,w2yu,bgfm76,Minor,Closed,Fixed,3.4.2019 19:56,4.4.2019 17:22,,,,,
OSSSUP-83685,1654575,,Configuration changes,CLAB3362 (IPv4&IPv6) - LTE19A adaptation patch deployment ,junlili,matyszok,Minor,Closed,Fixed,3.4.2019 18:43,4.4.2019 10:33,,,,,
OSSSUP-83684,1654533,,Question,CLAB1540 upgrade with SP577v21,magrocho,mrega,Minor,Closed,Fixed,3.4.2019 18:22,4.4.2019 3:03,,,,,
OSSSUP-83683,1654490,,Unplanned SW upgrade,[clab211][coop] SP1708 P8 (17.2.8.1517) installation,aprzybyl,bgfm76,Minor,Resolved,Fixed,3.4.2019 18:02,5.4.2019 22:10,,,,,
OSSSUP-83682,1654462,,Scratch installation,Left Sift: N18A P8 installation to slab644,magrocho,jeironen,Minor,Closed,Fixed,3.4.2019 17:41,16.4.2019 14:56,,,,,
OSSSUP-83681,1654299,,Unplanned SW upgrade,VSP0126 (IPv4&IPv6) upgrade with SP560v30,x30zhang,radzieje,Minor,Closed,Fixed,3.4.2019 16:24,4.4.2019 16:43,,,,,
OSSSUP-83680,1654137,,Question,Node Manager node CLAB2696 need installed and hang on CLAB3386,junlili,shenfeng,Minor,Closed,Fixed,3.4.2019 15:37,4.4.2019 9:43,,,,,
OSSSUP-83679,1654105,,Integration problem,SprintLab085 (IPv4 & IPv6) dns problem,aprzybyl,radzieje,Minor,Resolved,Fixed,3.4.2019 15:29,3.4.2019 15:42,,,,,
OSSSUP-83678,1653940,,Configuration changes,Please upgrade with  SP1808 on sprintlab475 and install SP606,junlili,girishr,Minor,Closed,Fixed,3.4.2019 12:18,4.4.2019 15:37,,,,,
OSSSUP-83677,1653797,,Scratch installation,Please help to install CLAB506 with latest N18A SP1904 QL4 build,w2yu,j47wang,Minor,Closed,Fixed,3.4.2019 10:48,11.4.2019 13:54,,,,,
OSSSUP-83676,1653638,,Scratch installation,Scratch install entity lab CLAB2620 to build 'netact19/product/19.0.0.204',x30zhang,x30zhang,Minor,Closed,Fixed,3.4.2019 9:27,3.4.2019 16:31,,,,,
OSSSUP-83675,1653637,,Question,please help install the latest trunk QL4 version in sprintlab381,x30zhang,hhai,Minor,Closed,Won't Fix,3.4.2019 9:27,12.4.2019 9:50,,,,,
OSSSUP-83674,1653562,,Scratch installation,[clab211][coop] NetAct 17.2 P8 (17.2.1.941) installation,aprzybyl,bgfm76,Minor,Resolved,Fixed,3.4.2019 1:32,5.4.2019 22:10,,,,,
OSSSUP-83673,1653485,,Scratch installation,VSP0027 -Installation,karraja,cbolchis,Minor,Closed,Fixed,2.4.2019 22:23,8.4.2019 21:42,,,,,
OSSSUP-83672,1653307,,Unplanned SW upgrade,Request to upgrade CloudLab813 with NA18A SP product,magrocho,pcatrino,Minor,Closed,Fixed,2.4.2019 19:05,3.4.2019 14:52,,,,,
OSSSUP-83671,1653304,,Scratch installation,Scratch installation failing for CLAb779 for NA19,w2yu,pradhika,Minor,Closed,Closed,2.4.2019 18:58,3.4.2019 13:01,,,,,
OSSSUP-83670,1653217,,Unplanned SW upgrade,[Clab565][coop] SP1902 installation,magrocho,bgfm76,Minor,Closed,Fixed,2.4.2019 17:37,4.4.2019 3:00,,,,,
OSSSUP-83669,1653057,,Configuration changes,Configure DCSA client on Clab1014,jatomczy,udayagir,Minor,Resolved,Fixed,2.4.2019 16:53,2.4.2019 17:03,,,,,
OSSSUP-83668,1652944,,Unplanned SW upgrade,VSP0020 upgrade request,x30zhang,jualin,Minor,Closed,Fixed,2.4.2019 15:58,4.4.2019 17:02,,,,,
OSSSUP-83667,1652936,,Unplanned SW upgrade,CLAB3362 (IPv4&IPv6) upgrade with SP604v3,w2yu,matyszok,Minor,Closed,Fixed,2.4.2019 15:54,2.4.2019 17:03,,,,,
OSSSUP-83666,1652765,,Scratch installation,Upgrade of NA19 latest build on Clab099 is required,aprzybyl,udayagir,Minor,Resolved,Fixed,2.4.2019 14:30,3.4.2019 20:43,,,,,
OSSSUP-83665,1652588,,Unplanned SW upgrade,Request to scratch install clab3349 with NA18A P8 and then upgrade to netact18a_sp/product/18.2.99.1008,w2yu,y67li,Minor,Closed,Fixed,2.4.2019 10:52,3.4.2019 8:59,,,,,
OSSSUP-83664,1652567,,Scratch installation,Scratch installation failing for CLAb1051 for NA19,w2yu,pradhika,Minor,Closed,Closed,2.4.2019 10:46,2.4.2019 13:22,,,,,
OSSSUP-83663,1652282,,Configuration changes,[Sprintlab575] -Snapshot on NA19 on Sprintlab575 is required,karraja,udayagir,Minor,Closed,Fixed,1.4.2019 21:47,2.4.2019 18:03,,,,,
OSSSUP-83662,1652259,,Unplanned SW upgrade,CLAB3362 (IPv4&IPv6) upgrade with SP577v20,karraja,radzieje,Minor,Closed,Fixed,1.4.2019 21:12,2.4.2019 15:58,,,,,
OSSSUP-83661,1652158,,Scratch installation,NMS installation into OSSSII0003,,jeironen,Minor,Closed,Won't Fix,1.4.2019 19:26,1.4.2019 20:12,,,,,
OSSSUP-83660,1652033,,Scratch installation,Request to Scratch install VSP0101 with netact19/product/19.0.0.200,karraja,prithika,Minor,Closed,Fixed,1.4.2019 17:50,17.4.2019 11:49,,,,,
OSSSUP-83659,1651936,,Integration request,Please install fastpath SP604 on vsp028,junlili,ioanas,Minor,Closed,Fixed,1.4.2019 16:47,2.4.2019 9:24,,,,,
OSSSUP-83658,1651932,,Configuration problem / Broken lab,Request to upgrade CM componet for CloudLab813 ,junlili,pcatrino,Minor,Closed,Fixed,1.4.2019 16:45,2.4.2019 9:42,,,,,
OSSSUP-83657,1651909,,Question,LAB3386 need be scratch NA18A P8 + SP1902 with ALS way,x30zhang,shenfeng,Minor,Closed,Fixed,1.4.2019 16:26,3.4.2019 15:34,,,,,
OSSSUP-83656,1651861,,Other,[sprintlab323] - help to install NetAct licenses,magrocho,binxia,Minor,Closed,Fixed,1.4.2019 15:59,1.4.2019 16:11,,,,,
OSSSUP-83655,1651859,,Other,CLAB3362 (IPv4&IPv6) overloaded disc,aprzybyl,radzieje,Minor,Resolved,Fixed,1.4.2019 15:59,1.4.2019 16:18,,,,,
OSSSUP-83654,1651801,,Other,CLAB013 NetAct 18A SP1902 scratch installation requested with ALS,w2yu,yliolli,Minor,Closed,Fixed,1.4.2019 15:22,4.4.2019 10:32,,,,,
OSSSUP-83653,1651777,,Other,FM adaptor getting failed in CLAB3493.,aprzybyl,sudhkuma,Minor,Resolved,Fixed,1.4.2019 15:06,2.4.2019 19:01,,,,,
OSSSUP-83652,1651723,,Scratch installation,[DR lab sitea] Please help to install NA19 on DR sprint lab 629,aprzybyl,fiozhu,Minor,Resolved,Fixed,1.4.2019 14:40,17.4.2019 16:20,,,,,
OSSSUP-83651,1651688,,Unplanned SW upgrade,CloudLab3444 upgrade failure,karraja,pradhika,Minor,Closed,Fixed,1.4.2019 14:21,17.4.2019 11:50,,,,,
OSSSUP-83650,1651555,,Other,VSP0017 Upgrade failed,x30zhang,zezhao,Minor,Closed,Won't Fix,1.4.2019 13:55,1.4.2019 16:21,,,,,
OSSSUP-83649,1651540,,Configuration problem / Broken lab,[CBR] VSP0129 lab is unusable after reverting to snapshot,x30zhang,ksokolow,Minor,Closed,Fixed,1.4.2019 13:54,2.4.2019 16:11,,,,,
OSSSUP-83648,1651113,,Scratch installation,Help to scratch install CLAB3331 with NA18A SP1811 build ,junlili,kaitang,Minor,Closed,Fixed,1.4.2019 9:44,2.4.2019 9:34,,,,,
OSSSUP-83647,1651096,,Scratch installation,Scratch install entity lab CLAB3271 to build 'netact19/product/19.0.0.198',x30zhang,x30zhang,Minor,Closed,Fixed,1.4.2019 9:42,1.4.2019 16:22,,,,,
OSSSUP-83646,1650895,,Unplanned SW upgrade,[Clab565][coop] SP560v28 installation,karraja,bgfm76,Minor,Closed,Fixed,29.3.2019 22:37,1.4.2019 13:01,,,,,
OSSSUP-83645,1650743,,Scratch installation,Deploy infrustructure and install NetAct on VSP0033,magrocho,katafias,Minor,Closed,Fixed,29.3.2019 19:44,1.4.2019 4:25,,,,,
OSSSUP-83644,1650607,,Question,SP1903 P8 install failed,w2yu,stalin,Minor,Closed,Fixed,29.3.2019 17:37,1.4.2019 17:05,,,,,
OSSSUP-83643,1650555,,Integration request,Installation VSP0028,magrocho,ioanas,Minor,Closed,Fixed,29.3.2019 16:54,1.4.2019 16:55,,,,,
OSSSUP-83642,1650550,,Question,Please help to upgrade clab3374 with latest netact18a_sp/product version,karraja,liduan,Minor,Closed,Fixed,29.3.2019 16:50,1.4.2019 13:03,,,,,
OSSSUP-83641,1650510,,Other,LeftShift: VSP0017: N19 upgrade: Run System_Configurations_WF_common fails,,viyou,Critical,Closed,Won't Fix,29.3.2019 16:42,1.4.2019 10:30,,,,,
OSSSUP-83640,1650482,,Configuration problem / Broken lab,[VSP0104] Scratch install to trunk QL4,x30zhang,lshi,Minor,Closed,Fixed,29.3.2019 16:20,4.4.2019 9:23,,,,,
OSSSUP-83639,1650260,,Unplanned SW upgrade,Scratch install Netact to NetAct 19 PT07,w2yu,sgn,Minor,Closed,Closed,29.3.2019 14:28,29.3.2019 16:45,,,,,
OSSSUP-83638,1649709,,Question,Monitor of NetAct is not getting launched,karraja,udayagir,Major,Closed,Fixed,28.3.2019 21:26,29.3.2019 17:09,,,,,
OSSSUP-83637,1650106,,Other,VSP0017 license expired,karraja,karraja,Minor,Closed,Fixed,29.3.2019 10:57,29.3.2019 12:28,,,,,
OSSSUP-83636,1650094,,Integration problem,"MME FLEXINS-123456 integrated to Netact clab039 failed, please help to check.",x30zhang,ningdz,Minor,Closed,Fixed,29.3.2019 10:33,29.3.2019 16:53,,,,,
OSSSUP-83635,1650076,,Scratch installation,Please install CloudLab3551 with newest Trunk QL4 version,w2yu,lijzeng,Minor,Closed,Fixed,29.3.2019 10:11,29.3.2019 10:18,,,,,
OSSSUP-83634,1650065,,Scratch installation,Scratch install CLAB1040 to SP1903 P8 build,x30zhang,x30zhang,Minor,Closed,Fixed,29.3.2019 10:02,29.3.2019 17:02,,,,,
OSSSUP-83633,1649994,,Scratch installation,Scratch install entity lab CLAB168 to build 'netact19/product/19.0.0.186',x30zhang,x30zhang,Minor,Closed,Fixed,29.3.2019 9:47,29.3.2019 14:26,,,,,
OSSSUP-83632,1649841,,Question,vmware license expired for vsp0031,karraja,karraja,Minor,Closed,Fixed,29.3.2019 0:43,29.3.2019 0:51,,,,,
OSSSUP-83631,1649746,,Integration request,[clab3011][coop] Multilayer certificates installation,aprzybyl,bgfm76,Minor,Resolved,Fixed,28.3.2019 22:02,28.3.2019 22:45,,,,,
OSSSUP-83630,1649671,,Unplanned SW upgrade,[clab332] SP577v20 installation,magrocho,bgfm76,Minor,Closed,Fixed,28.3.2019 20:37,29.3.2019 4:09,,,,,
OSSSUP-83629,1649663,,Unplanned SW upgrade,CLAB1335 (IPv4 & IPv6) upgrade with SP577v20,magrocho,radzieje,Minor,Closed,Fixed,28.3.2019 20:28,29.3.2019 4:07,,,,,
OSSSUP-83628,1649600,,Unplanned SW upgrade,SprintLab085 (IPv4 & IPv6) dns problem,aprzybyl,radzieje,Minor,Resolved,Fixed,28.3.2019 19:27,28.3.2019 23:42,,,,,
OSSSUP-83627,1649495,,Integration problem,"vsp0028: following scratch install, adaptations loading error ",magrocho,cerdei,Minor,Closed,Fixed,28.3.2019 17:38,29.3.2019 17:57,,,,,
OSSSUP-83626,1649489,,Integration request,Need  more IPs for 4 BTSMeds and 2 for resilience A-S Pairs x2 on  VSP0028,jatomczy,ioanas,Minor,Closed,Fixed,28.3.2019 17:34,28.3.2019 17:45,,,,,
OSSSUP-83625,1649470,,Unplanned SW upgrade,Request to upgrade clab3349 to netact18a_sp/product/18.2.99.998,karraja,wbin,Minor,Closed,Fixed,28.3.2019 17:29,29.3.2019 14:41,,,,,
OSSSUP-83624,1649157,,Integration request,OMS Astatine integration,w2yu,nkujala,Minor,Closed,Closed,28.3.2019 15:11,28.3.2019 15:23,,,,,
OSSSUP-83623,1648867,,Scratch installation,Scratch installation on CLAB741 failed,junlili,joran,Minor,Closed,Fixed,28.3.2019 13:18,29.3.2019 15:04,,,,,
OSSSUP-83622,1648840,,Other,LeftShift: VSP0017: N19 upgrade: Run System_Configurations_WF,hanxiao,viyou,Critical,Closed,Fixed,28.3.2019 13:06,8.11.2019 13:27,,,,,
OSSSUP-83621,1648834,,Configuration changes,Please install SP606 on vsp0127 ,w2yu,girishr,Minor,Closed,Fixed,28.3.2019 13:01,1.4.2019 10:54,,,,,
OSSSUP-83620,1648712,,Other,LeftShift: sprintlab647: N19 upgrade: enable_root_ssh : Enable SSH root login to NetAct VMs,hanxiao,viyou,Critical,Closed,Fixed,28.3.2019 10:42,1.4.2019 10:16,,,,,
OSSSUP-83619,1648696,,Other,[sprintlab323] - take snapshot and install netact18a/SP575/8,x30zhang,binxia,Minor,Closed,Fixed,28.3.2019 10:33,1.4.2019 14:21,,,,,
OSSSUP-83618,1648352,,Configuration changes,CLAB1335 Changing of password policies for service types,magrocho,parnold,Minor,Closed,Fixed,27.3.2019 21:11,28.3.2019 15:11,,,,,
OSSSUP-83617,1648090,,Other,CLAB3362 (IPv4&IPv6) overloaded disc,aprzybyl,radzieje,Minor,Resolved,Fixed,27.3.2019 17:34,27.3.2019 17:39,,,,,
OSSSUP-83616,1648088,,Unplanned SW upgrade,Request to upgrade clab3349 to netact18a_sp/product/18.2.99.993,karraja,wbin,Minor,Closed,Fixed,27.3.2019 17:34,28.3.2019 11:01,,,,,
OSSSUP-83615,1648015,,Unplanned SW upgrade,Request to upgrade CloudLab813 with NA18A SP product,x30zhang,pcatrino,Minor,Closed,Fixed,27.3.2019 17:01,28.3.2019 9:30,,,,,
OSSSUP-83614,1647910,,Unplanned SW upgrade,Request to upgrade vsp0107 to  netact18a_sp/product/18.2.99.993,w2yu,limin,Minor,Closed,Fixed,27.3.2019 16:01,29.3.2019 9:40,,,,,
OSSSUP-83613,1647852,,Other,[CBR] Snapshot revert and new snapshot creation for VSP0130,junlili,chapko,Minor,Closed,Fixed,27.3.2019 15:26,27.3.2019 16:13,,,,,
OSSSUP-83612,1647810,,Unplanned SW upgrade,[VSP0057] Please install validators,junlili,kgolabek,Minor,Closed,Fixed,27.3.2019 15:06,27.3.2019 16:39,,,,,
OSSSUP-83611,1647796,,Integration problem,Netact didn't work under RGR50 BSC software level,x30zhang,cjakab,Minor,Closed,Fixed,27.3.2019 15:03,27.3.2019 15:50,,,,,
OSSSUP-83610,1647612,,Question,CLAB3385 need be scratch NA18A P8 + SP1902 with ALS way,x30zhang,shenfeng,Minor,Closed,Fixed,27.3.2019 13:27,28.3.2019 16:39,,,,,
OSSSUP-83609,1647599,,Unplanned SW upgrade,please scratch install vosp0005 to NA19 build: netact19_fp_test/product/19.0.0.164.3,magrocho,a1wang,Minor,Closed,Fixed,27.3.2019 13:16,17.6.2019 12:35,,,,,
OSSSUP-83608,1647596,,Unplanned SW upgrade,please scratch install vosp0002 to NA19 build: netact19_fp_test/product/19.0.0.164.3,k1n,a1wang,Minor,Resolved,Fixed,27.3.2019 13:14,22.4.2019 15:17,,,,,
OSSSUP-83607,1647564,,Unplanned SW upgrade,Upgrade CLAB3483 with cm/configurator/19.6.0.3521 or higher build,w2yu,sushb,Minor,Closed,Fixed,27.3.2019 11:47,27.3.2019 15:59,,,,,
OSSSUP-83606,1647527,,Question,Please install Node Manager CLAB1970 with netact19 latest green release,karraja,shengshu,Major,Closed,Fixed,27.3.2019 10:33,28.3.2019 15:35,,installation,,,
OSSSUP-83605,1647528,,Question,"clab500node02 is ""no connection"" ",w2yu,guowli,Minor,Closed,Fixed,27.3.2019 10:35,28.3.2019 8:49,,,,,
OSSSUP-83604,1647502,,Integration request,"Please integrate MME FLEXINS-123456 to NetAct CLAB039,thanks.",w2yu,ningdz,Minor,Closed,Closed,27.3.2019 10:04,27.3.2019 11:06,,,,,
OSSSUP-83603,1647460,,Scratch installation,Scratch install entity lab CLAB2620 to build 'netact19/product/19.0.0.177',x30zhang,x30zhang,Minor,Closed,Fixed,27.3.2019 9:27,27.3.2019 16:12,,,,,
OSSSUP-83602,1647399,,Scratch installation,NetAct 18A SP1903 P8 candidate build installation into CLAB3019,w2yu,ajarvi,Minor,Closed,Fixed,27.3.2019 3:08,27.3.2019 20:35,,,,,
OSSSUP-83601,1647235,,Integration request,[CLAB3362] FL18A Reporting Suite installation Request [Netact 18A],jatomczy,sekang,Minor,Resolved,Fixed,26.3.2019 21:48,27.3.2019 18:39,,,,,
OSSSUP-83600,1647213,,Unplanned SW upgrade,VSP0126 (IPv4&IPv6) upgrade with SP1903 P8,jatomczy,radzieje,Minor,Closed,Fixed,26.3.2019 21:26,27.3.2019 15:51,,,,,
OSSSUP-83599,1647167,,Other,CLAB3019 - upgrade to NA18A SP1812,aprzybyl,pgora,Minor,Resolved,Fixed,26.3.2019 21:10,27.3.2019 2:28,,,,,
OSSSUP-83598,1647166,,Unplanned SW upgrade,SprintLab085 (IPv4 & IPv6) customer like upgrade with SP577v20,magrocho,radzieje,Minor,Closed,Fixed,26.3.2019 21:08,27.3.2019 15:48,,,,,
OSSSUP-83597,1647134,,Configuration problem / Broken lab,[CLAB 711][CLAB 1682] Service dns-master not started on node clab1682node01,aprzybyl,tebissi,Minor,Resolved,Fixed,26.3.2019 20:25,26.3.2019 22:18,,,,,
OSSSUP-83596,1647127,,Unplanned SW upgrade,SprintLab368 (IPv4&IPv6) customer like installation with SP577v20,magrocho,radzieje,Minor,Closed,Fixed,26.3.2019 20:23,27.3.2019 6:05,,,,,
OSSSUP-83595,1647087,,Unplanned SW upgrade,CLAB708 (IPv4 & IPv6) upgrade with SP577v20,magrocho,radzieje,Minor,Closed,Fixed,26.3.2019 19:38,26.3.2019 22:11,,,,,
OSSSUP-83594,1647063,,Configuration problem / Broken lab,Node clab2996node15 is broken,aprzybyl,cmos,Minor,Resolved,Fixed,26.3.2019 19:13,26.3.2019 21:24,,,,,
OSSSUP-83593,1646782,,Question,Upgrade from SP588 to N19 is failed,karraja,liulin,Minor,Closed,Fixed,26.3.2019 16:23,17.4.2019 11:51,,,,,
OSSSUP-83592,1646737,,Scratch installation,Left Sift: N18A P8 installation to slab486,jatomczy,jeironen,Minor,Closed,Fixed,26.3.2019 16:03,15.4.2019 16:36,,,,,
OSSSUP-83591,1646720,,Scratch installation,LeftSift: VSP0023 scratch & SP upgrade,magrocho,jeironen,Minor,Closed,Fixed,26.3.2019 15:54,29.3.2019 18:20,,,,,
OSSSUP-83590,1646704,,Scratch installation,Request to scratch install vsp0038,junlili,limin,Minor,Closed,Fixed,26.3.2019 15:44,29.3.2019 9:30,,,,,
OSSSUP-83589,1646702,,Configuration problem / Broken lab,[CBR] VSP130 omc user recovery needed,magrocho,chapko,Minor,Closed,Fixed,26.3.2019 15:43,27.3.2019 15:13,,,,,
OSSSUP-83588,1646701,,Scratch installation,LeftSift: VSP0030 scratch & SP upgrade,magrocho,jeironen,Minor,Closed,Fixed,26.3.2019 15:42,29.3.2019 20:06,,,,,
OSSSUP-83587,1646644,,Unplanned SW upgrade,Request to upgrade vsp0107 to the latest QL4 of SP1904,w2yu,limin,Minor,Closed,Fixed,26.3.2019 15:23,27.3.2019 9:43,,,,,
OSSSUP-83586,1646605,,Integration request,Installation  SP1708 on VSP0057,magrocho,magrocho,Minor,Closed,Fixed,26.3.2019 14:57,26.3.2019 14:58,,,,,
OSSSUP-83585,1646575,,Integration request,[CLAB849] DNS resolution [NetAct 18A SP1901 + Dedicated SP577 P7.1 SP577 P7.1 + SP560],w2yu,dyoo,Minor,Closed,Fixed,26.3.2019 14:40,26.3.2019 15:25,,,,,
OSSSUP-83584,1646244,,Scratch installation,[CLAB3416] scratch installation trunk latest QL4,w2yu,lshi,Minor,Closed,Fixed,26.3.2019 9:26,27.3.2019 9:01,,,,,
OSSSUP-83583,1646100,,Unplanned SW upgrade,SP568v23 install on VSP0066,aprzybyl,aretezan,Minor,Resolved,Fixed,25.3.2019 22:41,26.3.2019 15:11,,,,,
OSSSUP-83582,1646068,,Unplanned SW upgrade,clab553node01 south IP not pingable - please check,aprzybyl,radzieje,Minor,Resolved,Fixed,25.3.2019 22:01,26.3.2019 22:19,,,,,
OSSSUP-83581,1646038,,Unplanned SW upgrade,VSP0126 (IPv4&IPv6) upgrade with SP577v20,magrocho,radzieje,Minor,Closed,Fixed,25.3.2019 21:40,26.3.2019 5:20,,,,,
OSSSUP-83580,1646012,,Unplanned SW upgrade,CLAB216 (IPv4 & IPv6) upgrade with SP577v20,magrocho,radzieje,Minor,Closed,Fixed,25.3.2019 21:20,26.3.2019 5:18,,,,,
OSSSUP-83579,1646009,,Unplanned SW upgrade,CLAB083 (IPv4 & IPv6) upgrade with SP577v20,magrocho,radzieje,Minor,Closed,Fixed,25.3.2019 21:18,26.3.2019 5:17,,,,,
OSSSUP-83578,1646007,,Integration request,[clab3011] CLS integration,magrocho,marpiotr,Minor,Closed,Fixed,25.3.2019 21:17,26.3.2019 6:07,,,,,
OSSSUP-83577,1645934,,Unplanned SW upgrade,CLAB3540 (IPv4&IPv6) revert to snapshot + upgrade with SP577v20,jatomczy,radzieje,Minor,Closed,Fixed,25.3.2019 20:05,26.3.2019 15:42,,,,,
OSSSUP-83576,1645931,,Unplanned SW upgrade,SprintLab368 (IPv4&IPv6) revert to snap + customer like upgrade with SP577v13,magrocho,radzieje,Minor,Closed,Fixed,25.3.2019 20:02,26.3.2019 20:12,,,,,
OSSSUP-83575,1645928,,Unplanned SW upgrade,VSP0000 (IPv4 & IPv6) revert to snapshot + upgrade with SP577v20,magrocho,radzieje,Minor,Closed,Fixed,25.3.2019 19:57,26.3.2019 5:26,,,,,
OSSSUP-83574,1645915,,Unplanned SW upgrade,Upgrade CLAB782 with SP577 v20,jatomczy,dporebsk,Minor,Closed,Fixed,25.3.2019 19:45,26.3.2019 15:41,,,,,
OSSSUP-83573,1645909,,Unplanned SW upgrade,Upgrade CLAB3006 with SP577 v20,jatomczy,dporebsk,Minor,Resolved,Fixed,25.3.2019 19:39,25.3.2019 22:29,,,,,
OSSSUP-83572,1645676,,Other,Clab108 certs installation,aprzybyl,abala,Minor,Resolved,Fixed,25.3.2019 17:26,25.3.2019 18:16,,,,,
OSSSUP-83571,1645611,,Other,[vsp0019] Revert a snapshot,junlili,hannwang,Minor,Closed,Fixed,25.3.2019 17:01,26.3.2019 10:14,,,,,
OSSSUP-83570,1645597,,Other,BTSMED19 setup for LTE19 tests,x30zhang,sushb,Minor,Closed,Fixed,25.3.2019 16:59,26.3.2019 14:02,,,,,
OSSSUP-83569,1645588,,Question,please help install clab3381 with newest netact trunk QL4,x30zhang,hhai,Minor,Closed,Fixed,25.3.2019 16:57,26.3.2019 9:25,,,,,
OSSSUP-83568,1645506,,Other,[CLAB804] - upgrade to SP1901 failed,junlili,binxia,Minor,Closed,Fixed,25.3.2019 16:28,26.3.2019 9:10,,,,,
OSSSUP-83567,1645410,,Unplanned SW upgrade,Upgrade Clab126 to SP1802,jatomczy,fenghu,Minor,Closed,Done,25.3.2019 15:36,25.3.2019 16:38,,,,,
OSSSUP-83566,1645300,,Unplanned SW upgrade,[Sprintlab470] Please install validators,w2yu,kgolabek,Minor,Closed,Fixed,25.3.2019 14:28,25.3.2019 16:44,,,,,
OSSSUP-83565,1645186,,Scratch installation,Help install 18A P8 in CLAB500 please.,junlili,ahua,Minor,Closed,Fixed,25.3.2019 13:38,26.3.2019 9:08,,,,,
OSSSUP-83564,1645184,,Integration request,Request to integrate Node manager to VSP0018,junlili,prithika,Minor,Closed,Closed,25.3.2019 13:37,29.3.2019 15:41,,,,,
OSSSUP-83563,1645149,,Unplanned SW upgrade,CLAB612: SP577P7.2 upgrade failed,junlili,z001upxa,Minor,Closed,Fixed,25.3.2019 13:05,25.3.2019 16:28,,,,,
OSSSUP-83562,1645148,,Question,Please help to install clab584 for PR verification,x30zhang,j68chen,Minor,Closed,Fixed,25.3.2019 13:03,27.3.2019 9:33,,,,,
OSSSUP-83561,1645122,,Configuration changes,please help upgrade inventory to MED/INVENTORYMED/19.1.1.8 -  clab3422,karraja,hhai,Minor,Closed,Fixed,25.3.2019 11:49,25.3.2019 12:47,,,,,
OSSSUP-83560,1645113,,Question,Please help to install clab1040 on upgrade path SP1901 + netact18a/SP577/9 -> N18A SP1903,w2yu,j68chen,Minor,Closed,Fixed,25.3.2019 11:25,27.3.2019 9:06,,,,,
OSSSUP-83559,1645081,,Question,please help upgrade inventory to MED/INVENTORYMED/19.1.1.8 of clab3377 and clab3422,karraja,hhai,Minor,Closed,Fixed,25.3.2019 10:38,25.3.2019 12:47,,,,,
OSSSUP-83558,1645041,,Scratch installation,Scratch installation of N18A SP trunk failed on CLAB3378,junlili,amyli,Minor,Closed,Fixed,25.3.2019 10:08,27.3.2019 10:44,,,,,
OSSSUP-83557,1645031,,Unplanned SW upgrade,"Lab_Installation_Upgrade Jenkins page is not reached, could you please help to upgrade N8_labs/CLAB584 to NA18A SP1902 P8 and take snapsot",w2yu,j68chen,Minor,Closed,Fixed,25.3.2019 9:59,25.3.2019 13:05,,,,,
OSSSUP-83556,1645011,,Scratch installation,Scratch install entity lab CLAB3271 to build 'netact19/product/19.0.0.173',x30zhang,x30zhang,Minor,Closed,Fixed,25.3.2019 9:24,25.3.2019 17:06,,,,,
OSSSUP-83555,1644974,,Configuration changes,Installation SP500 v. 28 sprintlab470 ,magrocho,magrocho,Minor,Closed,Fixed,25.3.2019 6:33,25.3.2019 6:52,,,,,
OSSSUP-83554,1644972,,Configuration changes,Installation SP577 v 13 on VSP0028,,magrocho,Minor,Closed,Fixed,25.3.2019 5:50,25.3.2019 5:52,,,,,
OSSSUP-83553,1644967,,Question,SP568 v 20 installation on vsp0028,magrocho,magrocho,Minor,Closed,Fixed,25.3.2019 3:21,25.3.2019 3:23,,,,,
OSSSUP-83552,1644911,,Unplanned SW upgrade,Scratch install NetAct 18A SP1902 on DCCA EDEN0041,x30zhang,masokhan,Minor,Closed,Fixed,23.3.2019 6:27,26.3.2019 9:24,,,,,
OSSSUP-83551,1644842,,Unplanned SW upgrade,CLAB216 (IPv4 & IPv6) upgrade with SP577v17,jatomczy,radzieje,Minor,Closed,Fixed,22.3.2019 23:47,25.3.2019 15:41,,,,,
OSSSUP-83550,1644839,,Scratch installation,[clab332][coop] post install tasks,aprzybyl,bgfm76,Minor,Resolved,Fixed,22.3.2019 23:44,25.3.2019 20:32,,,,,
OSSSUP-83549,1644827,,Configuration problem / Broken lab,[CLab3011][coop] Licenses expired,aprzybyl,bgfm76,Minor,Resolved,Fixed,22.3.2019 23:05,22.3.2019 23:33,,,,,
OSSSUP-83548,1644817,,Unplanned SW upgrade,installation of SP568v20 on VSP0011,jatomczy,mariusr,Minor,Closed,Fixed,22.3.2019 22:46,22.3.2019 23:53,,,,,
OSSSUP-83547,1644816,,Other,[clab1364][coop] preparing snapshot,jatomczy,bgfm76,Minor,Closed,Fixed,22.3.2019 22:41,25.3.2019 18:39,,,,,
OSSSUP-83546,1644805,,Unplanned SW upgrade,CLAB708 (IPv4 & IPv6) DCSA snapshot and upgrade with SP577v17,jatomczy,radzieje,Minor,Closed,Fixed,22.3.2019 22:28,25.3.2019 15:45,,,,,
OSSSUP-83545,1644801,,Unplanned SW upgrade,[Coop0000][coop] PPValidator166v1 installation,jatomczy,bgfm76,Minor,Resolved,Fixed,22.3.2019 22:24,22.3.2019 23:53,,,,,
OSSSUP-83544,1644756,,Unplanned SW upgrade,installation of SP568v22 on VSP0027,jatomczy,mariusr,Minor,Closed,Fixed,22.3.2019 21:53,22.3.2019 22:48,,,,,
OSSSUP-83543,1644744,,Unplanned SW upgrade,installation of SP568v22 on VSP0061,jatomczy,mariusr,Minor,Closed,Fixed,22.3.2019 21:47,22.3.2019 22:30,,,,,
OSSSUP-83542,1644695,,Unplanned SW upgrade,installation of SP568v22 on VSP0068,jatomczy,mariusr,Minor,Resolved,Fixed,22.3.2019 20:43,22.3.2019 21:40,,,,,
OSSSUP-83541,1644691,,Unplanned SW upgrade,installation of SP568v22 on VSP0066,jatomczy,mariusr,Minor,Closed,Fixed,22.3.2019 20:37,22.3.2019 21:40,,,,,
OSSSUP-83540,1644604,,Question,Cannot log in to clab3011 on omc23 account,jatomczy,leluch,Minor,Closed,Fixed,22.3.2019 18:38,22.3.2019 18:58,,,,,
OSSSUP-83539,1644546,,Unplanned SW upgrade,[clab332][coop] SP577v17 installation,aprzybyl,bgfm76,Minor,Resolved,Fixed,22.3.2019 18:03,22.3.2019 22:59,,,,,
OSSSUP-83538,1644523,,Unplanned SW upgrade,CLAB708 (IPv4 & IPv6) upgrade with SP1812 P8,jatomczy,radzieje,Minor,Closed,Fixed,22.3.2019 17:46,22.3.2019 21:50,,,,,
OSSSUP-83537,1644488,,Scratch installation,Request to scratch install sprintlab495 with NetAct 18A SP1901,aprzybyl,cknv84,Minor,Resolved,Fixed,22.3.2019 17:24,17.4.2019 20:42,,,,,
OSSSUP-83536,1644393,,Unplanned SW upgrade,CLAB3540 (IPv4&IPv6) upgrade with SP577v17,aprzybyl,radzieje,Minor,Resolved,Fixed,22.3.2019 16:42,22.3.2019 17:45,,,,,
OSSSUP-83535,1644292,,Configuration problem / Broken lab,[CLAB140] NetAct doesn't work,x30zhang,kgolabek,Minor,Closed,Fixed,22.3.2019 15:52,22.3.2019 17:09,,,,,
OSSSUP-83534,1644243,,Scratch installation,[Sprintlab470] Scratch with NetAct18 P8,magrocho,kgolabek,Minor,Closed,Fixed,22.3.2019 15:26,25.3.2019 6:56,,,,,
OSSSUP-83533,1644235,,Scratch installation,[VSP0057] Scratch with NetAct17.2 P8 - 17.2.1.941,magrocho,kgolabek,Minor,Closed,Fixed,22.3.2019 15:21,26.3.2019 18:44,,,,,
OSSSUP-83532,1644175,,Other,[Sprintlab323] - install SP1812 and netact18a/SP575/8,vt,binxia,Minor,Closed,Fixed,22.3.2019 14:53,27.3.2019 20:17,,,,,
