Issue key,Issue id,Parent id,Issue Type,Summary,Assignee,Reporter,Priority,Status,Resolution,Created,Updated,Due Date,Labels,Labels,Labels,Custom field (Resolution.)
OSSSUP-86901,1888008,,Configuration problem / Broken lab,[clab1346] lab re-allocation,aprzybyl,tlisowsk,Minor,Resolved,Fixed,30.12.2019 18:32,30.12.2019 21:08,,,,,
OSSSUP-86895,1886715,,Scratch installation,[CLAB1007] scratch install with the latest QL4 trunk build,junlili,kuzhang,Minor,Closed,Fixed,27.12.2019 13:26,17.1.2020 10:46,,,,,
OSSSUP-86893,1886380,,Unplanned SW upgrade,CLAB1347 upgrade with FP659 (SRAN20A support),junlili,parnold,Minor,Closed,Fixed,26.12.2019 20:32,27.12.2019 10:04,,,,,
OSSSUP-86892,1886379,,Unplanned SW upgrade,CLAB1372 upgrade with FP659 (SRAN20A support),junlili,parnold,Minor,Closed,Fixed,26.12.2019 20:31,27.12.2019 10:03,,,,,
OSSSUP-86891,1886376,,Unplanned SW upgrade,Sprintlab085 customer like upgrade with FP659,junlili,parnold,Minor,Closed,Fixed,26.12.2019 20:26,27.12.2019 10:08,,,,,
OSSSUP-86890,1885971,,Question,sprintlab473 upgrade failed due to the wrong password,k1n,m16li,Minor,Resolved,Resolved,26.12.2019 13:33,27.12.2019 9:06,,,,,
OSSSUP-86889,1885161,,Unplanned SW upgrade,Upgrade CLAB1040 to SP1912 build 'netact19_sp_stabi/product/19.0.12.74',x30zhang,x30zhang,Minor,Closed,Fixed,25.12.2019 9:27,25.12.2019 17:07,,,,,
OSSSUP-86888,1885160,,Scratch installation,Scratch install entity lab CLAB1564 to build 'netact/product/99.19.12.1.154',x30zhang,x30zhang,Minor,Closed,Fixed,25.12.2019 9:25,25.12.2019 17:07,,,,,
OSSSUP-86887,1884942,,Other,netact19_sp product upgrade failing in CLAB1187,w2yu,amrp,Minor,Closed,Fixed,24.12.2019 17:20,26.12.2019 13:48,,,,,
OSSSUP-86886,1884829,,Other,Configurator build upgrade is failing in CLAB2335,junlili,vkumars,Minor,Closed,Closed,24.12.2019 15:43,25.12.2019 15:11,,,,,
OSSSUP-86885,1884750,,Question,Clab3423 reinstall for latest trunk QL4,w2yu,kuni,Minor,Closed,Fixed,24.12.2019 15:02,25.12.2019 9:01,,,,,
OSSSUP-86884,1884595,,Other,Please upgrade VSP0114 LAB with SPREGISTERS20.2 fastpass package,k1n,a34gupta,Minor,Resolved,Resolved,24.12.2019 13:11,24.12.2019 19:29,,,,,
OSSSUP-86883,1884254,,Question,[CLAB512] Upgrade with cm_n19sp/configurator/19.5.0.776,junlili,kimak,Minor,Closed,Closed,23.12.2019 21:11,26.12.2019 17:18,,,,,
OSSSUP-86882,1884224,,Other,Scratch installation on CLAB3287 is failing,w2yu,vkumars,Minor,Closed,Fixed,23.12.2019 19:53,25.12.2019 9:02,,,,,
OSSSUP-86881,1884198,,Other,CLAB694 Post install tasks,aprzybyl,parnold,Minor,Resolved,Fixed,23.12.2019 19:00,23.12.2019 19:43,,,,,
OSSSUP-86879,1884037,,Other,After Snapshot Please upgrade lab VSP0114 to NetAct 19SP1912,k1n,a34gupta,Minor,Resolved,Resolved,23.12.2019 16:50,24.12.2019 12:53,,,,,
OSSSUP-86878,1884034,,Other,Please revert Lab VSP0114 Snapshot To NA19P8,k1n,a34gupta,Minor,Resolved,Resolved,23.12.2019 16:47,23.12.2019 18:29,,,,,
OSSSUP-86877,1883649,,Question,Fail to revert snapshot for CloudLab040,karraja,shengshu,Minor,Closed,Fixed,23.12.2019 11:43,24.12.2019 10:59,,,,,
OSSSUP-86876,1883629,,Scratch installation,CLAB 595 upgrade with latest ql4 19 SP product build is failing with error,karraja,kavyas,Minor,Closed,Fixed,23.12.2019 11:17,2.1.2020 15:19,,,,,
OSSSUP-86874,1883621,,Scratch installation,Scratch installation in 3470 is failing with errors. please install the lab with latest product build.,karraja,kavyas,Minor,Closed,Fixed,23.12.2019 11:14,24.12.2019 13:43,,,,,
OSSSUP-86873,1883596,,Scratch installation,Please help to install CLAB866 with NetAct SP1912 netact19_sp_stabi/product/19.0.12.73 + FP605,junlili,carhe,Minor,Closed,Fixed,23.12.2019 10:50,18.3.2020 10:59,,,,,
OSSSUP-86872,1883504,,Unplanned SW upgrade,Upgrade CLAB3271 to SP1912 build 'netact19_sp_stabi/product/19.0.12.73',x30zhang,x30zhang,Minor,Closed,Fixed,23.12.2019 9:28,23.12.2019 17:01,,,,,
OSSSUP-86871,1883499,,Scratch installation,Scratch install entity lab CLAB813 to build 'netact/product/99.19.12.0.140',x30zhang,x30zhang,Minor,Closed,Fixed,23.12.2019 9:26,23.12.2019 16:38,,,,,
OSSSUP-86870,1883205,,Configuration problem / Broken lab,Stabi Upgrade failure in CLAB654,karraja,monica,Minor,Closed,Fixed,22.12.2019 21:50,24.12.2019 13:26,,,,,
OSSSUP-86869,1883203,,Other,Upgrade failing in CLAB1187,karraja,amrp,Minor,Closed,Fixed,22.12.2019 18:09,24.12.2019 13:43,,,,,
OSSSUP-86868,1883168,,Unplanned SW upgrade,[clab1346] Please install the latest FP616 P7.4 + FP661 P7.1,aprzybyl,tlisowsk,Minor,Resolved,Fixed,21.12.2019 5:08,30.12.2019 18:30,,,,,
OSSSUP-86867,1883167,,Unplanned SW upgrade,[clab1169] Please install the latest FP661 P7.1,magrocho,tlisowsk,Minor,Closed,Fixed,21.12.2019 5:02,22.12.2019 18:27,,,,,
OSSSUP-86866,1883166,,Scratch installation,[clab2098] Please install NetAct 19,magrocho,tlisowsk,Minor,Closed,Fixed,21.12.2019 4:53,24.12.2019 14:48,,,,,
OSSSUP-86865,1882850,,Other,SP upgrade in CLAB202,magrocho,sudhkuma,Minor,Closed,Fixed,20.12.2019 18:11,21.12.2019 6:19,,,,,
OSSSUP-86863,1882815,,Unplanned SW upgrade,CLAB113 - installation of SP1912 v19.0.12.63 on NA19 P8,magrocho,matyszok,Minor,Closed,Fixed,20.12.2019 17:51,21.12.2019 2:14,,,,,
OSSSUP-86862,1882765,,Question,Adaptation Upgrade is failing in Sp lab,karraja,veep,Minor,Closed,Fixed,20.12.2019 17:24,23.12.2019 13:10,,,,,
OSSSUP-86861,1882754,,Question,Adaptation Upgrade is failing in Trunk ,karraja,veep,Minor,Closed,Fixed,20.12.2019 17:20,23.12.2019 11:18,,,,,
OSSSUP-86859,1882496,,Scratch installation,Please scratch install SP1911 with release netact19_sp_stabi/product/19.0.11.100 on CLAB1097,w2yu,shengshu,Minor,Closed,Fixed,20.12.2019 15:05,24.12.2019 9:27,,,,,
OSSSUP-86858,1882475,,Scratch installation,Please help to install BTSMED 19A on clab838node01,aprzybyl,carhe,Minor,Resolved,Fixed,20.12.2019 14:53,20.12.2019 21:12,,,,,
OSSSUP-86857,1882399,,Integration problem,parameter issue in integrate_ne.groovy,x30zhang,m16li,Minor,Closed,Fixed,20.12.2019 14:11,20.12.2019 14:43,,,,,
OSSSUP-86856,1882345,,Integration problem,CLAB336 upgrade to SP2001 met error,w2yu,sherxu,Minor,Closed,Fixed,20.12.2019 13:40,23.12.2019 9:02,,,,,
OSSSUP-86855,1882285,,Scratch installation,CLAB400 trunk installation failure,karraja,gottumuk,Minor,Closed,Fixed,20.12.2019 12:52,23.12.2019 11:40,,,,,
OSSSUP-86854,1882065,,Scratch installation,Scratch install entity lab CLAB1609 to build 'netact/product/99.19.12.0.124',x30zhang,x30zhang,Minor,Closed,Fixed,20.12.2019 9:35,20.12.2019 17:01,,,,,
OSSSUP-86853,1882061,,Unplanned SW upgrade,Upgrade CLAB2620 to SP2001 build 'netact19_sp/product/19.0.99.951',x30zhang,x30zhang,Minor,Closed,Fixed,20.12.2019 9:33,20.12.2019 17:02,,,,,
OSSSUP-86852,1881911,,Question,"NetAct clab1345 : step WCDMA Direct - Configure MRBTS ID to WBTS : Failed with error Download ftp error (file transfer failed) while downloading file, taskId: 909",x30zhang,dalbu,Minor,Closed,Won't Fix,19.12.2019 23:07,20.12.2019 17:01,,,,,
OSSSUP-86851,1881838,,Other,NASDA installation in CLAB689,junlili,sudhkuma,Minor,Closed,Fixed,19.12.2019 21:29,25.12.2019 15:17,,,,,
OSSSUP-86850,1881797,,Other,Upgrade on CLAB3470 is failing,w2yu,vkumars,Minor,Closed,Fixed,19.12.2019 20:29,23.12.2019 9:21,,,,,
OSSSUP-86848,1881521,,Scratch installation,CLAB694 - ALS scratch + installation of NA19 P8 + post tasks,jatomczy,matyszok,Minor,Resolved,Fixed,19.12.2019 16:51,20.12.2019 15:32,,,,,
OSSSUP-86847,1881515,,Scratch installation,Upgrade VSP0002 with SP1908 P8 build,k1n,udayagir,Minor,Resolved,Resolved,19.12.2019 16:49,30.12.2019 2:45,,,,,
OSSSUP-86846,1881491,,Other,NASDA installation in CLAB2187,magrocho,sudhkuma,Minor,Closed,Fixed,19.12.2019 16:36,19.12.2019 21:36,,,,,
OSSSUP-86845,1881191,,Other,Take 2nd snapshot of VSP0014 with NA19 SP1911 P8 build,junlili,pjailani,Minor,Closed,Fixed,19.12.2019 13:32,19.12.2019 14:25,,,,,
OSSSUP-86844,1881138,,Integration problem,Upgrade on CLAB1187 is failing,karraja,amrp,Minor,Closed,Fixed,19.12.2019 11:50,19.12.2019 11:54,,,,,
OSSSUP-86843,1881126,,Other,Upgrade failing  in CLAB1187,karraja,nelamang,Minor,Closed,Fixed,19.12.2019 11:30,19.12.2019 16:25,,,,,
OSSSUP-86842,1881116,,Scratch installation,[CLAB1280] component upgrade to MED/NE3SWS/20.0.0.144,junlili,lshi,Minor,Closed,Fixed,19.12.2019 11:16,19.12.2019 15:36,,,,,
OSSSUP-86841,1880695,,Other,Please help in upgrading CLAB1337 to the netact stabi,w2yu,karigar,Minor,Closed,Fixed,18.12.2019 22:04,20.12.2019 13:02,,,,,
OSSSUP-86840,1880641,,Integration problem,CLAB2266 - BTSMED node creation,jatomczy,matyszok,Minor,Closed,Fixed,18.12.2019 21:11,23.12.2019 14:57,,,,,
OSSSUP-86839,1880640,,Unplanned SW upgrade,SprintLab368 - upgrade FP635 to P8 on NA19 P8,jatomczy,matyszok,Minor,Resolved,Fixed,18.12.2019 21:09,18.12.2019 22:31,,VP(VerificationPipeline),,,
OSSSUP-86837,1880597,,Unplanned SW upgrade,CLAB2266 - installation of FP659 on NA19 P8,jatomczy,matyszok,Minor,Closed,Fixed,18.12.2019 20:20,23.12.2019 14:56,,VP(VerificationPipeline),,,
OSSSUP-86836,1880356,,Integration request,WCDMA-224 not properly integrated to OMS40 (RNC36) / NetAct,jatomczy,gleontiu,Minor,Closed,Fixed,18.12.2019 16:58,11.5.2020 14:04,,,,,
OSSSUP-86835,1879867,,Question,Node Manager node clab437 need be hanged below CLAB3386,junlili,shenfeng,Minor,Closed,Fixed,18.12.2019 10:51,19.12.2019 13:10,,,,,
OSSSUP-86834,1879772,,Unplanned SW upgrade,Upgrde CLAB1040 to SP1912 build 'netact19_sp_stabi/product/19.0.12.50',x30zhang,x30zhang,Minor,Closed,Fixed,18.12.2019 9:48,19.12.2019 9:24,,,,,
OSSSUP-86833,1879770,,Scratch installation,Scratch install entity lab CLAB1564 to build 'netact/product/99.19.12.0.115',x30zhang,x30zhang,Minor,Closed,Fixed,18.12.2019 9:45,19.12.2019 9:24,,,,,
OSSSUP-86832,1879649,,Unplanned SW upgrade,CLAB113 - installation of FP659 P7.5 on NA19,junlili,parnold,Minor,Closed,Fixed,18.12.2019 0:25,18.12.2019 10:53,,,,,
OSSSUP-86831,1879567,,Unplanned SW upgrade,[clab1169] Please install the latest FP616 P7.4 + FP661 P7.1,magrocho,tlisowsk,Minor,Closed,Fixed,17.12.2019 21:43,18.12.2019 17:08,,VP(VerificationPipeline),,,
OSSSUP-86830,1879495,,Scratch installation,Problem with mpp scratch installation on CloudLab1505,aprzybyl,anrutkow,Minor,Resolved,Fixed,17.12.2019 20:20,20.12.2019 17:05,,,,,
OSSSUP-86829,1879458,,Other,Please upgrade VSP0014 with NA19 SP1911 P8 build,hanxiao,pjailani,Minor,Closed,Fixed,17.12.2019 19:43,10.2.2020 11:59,,VP(VerificationPipeline),,,
OSSSUP-86828,1879449,,Scratch installation,Please help with scratch install QL4_99 of clab2312 (cloud_s v7),aprzybyl,szeremet,Minor,Resolved,Fixed,17.12.2019 19:36,19.12.2019 23:00,,,,,
OSSSUP-86827,1879334,,Other,CLAB595 lab GUI page is not accessible,karraja,vkumars,Minor,Closed,Fixed,17.12.2019 17:55,17.12.2019 18:10,,,,,
OSSSUP-86826,1879275,,Unplanned SW upgrade,CLAB2266 - snap + installation of SP1911 P8 on NA19 P8,aprzybyl,matyszok,Minor,Resolved,Fixed,17.12.2019 17:27,18.12.2019 17:23,,,,,
OSSSUP-86825,1879262,,Question,Please Junlin Li help to install FP605 on VSP0048,junlili,carhe,Minor,Closed,Fixed,17.12.2019 17:20,17.1.2020 10:46,,,,,
OSSSUP-86824,1878964,,Other,NASDA installation in CLAB3493,magrocho,sudhkuma,Minor,Closed,Fixed,17.12.2019 15:28,18.12.2019 17:17,,,,,
OSSSUP-86823,1878932,,Other,Please upgrade VSP0014 with NA19 SP1911 P8 build ,,pjailani,Minor,Resolved,Rejected,17.12.2019 15:13,18.12.2019 17:28,,,,,
OSSSUP-86822,1878912,,Other,Monitor page is not opening for CLAB1845,junlili,sudhkuma,Minor,Closed,Fixed,17.12.2019 15:06,18.12.2019 9:09,,,,,
OSSSUP-86821,1878904,,Configuration changes,SP1911 installation on CLAB1169,magrocho,magrocho,Minor,Closed,Fixed,17.12.2019 15:03,17.12.2019 20:49,,,,,
OSSSUP-86820,1878895,,Configuration changes,Please increase /d/db-arc to 5T,jatomczy,ssamadda,Minor,Closed,Fixed,17.12.2019 14:58,18.12.2019 16:51,,,,,
OSSSUP-86819,1878847,,Other,Please Scratch VSP0114 lab with NA19P8 build and after that upgrade it to NetAct SP1912,x30zhang,a34gupta,Minor,Closed,Fixed,17.12.2019 14:34,10.2.2020 11:59,,VP(VerificationPipeline),,,
OSSSUP-86818,1878809,,Other,Take snapshot of VSP0014 with NA19 P8 build,junlili,pjailani,Minor,Closed,Fixed,17.12.2019 14:14,17.12.2019 15:08,,,,,
OSSSUP-86817,1878664,,Question,Please help to upgrade VSP0048 to netact18a/SP603/19,,carhe,Minor,Closed,Fixed,17.12.2019 12:56,17.12.2019 13:09,,,,,
OSSSUP-86816,1878662,,Question,Please help to upgrade VSP0048 to netact18a/SP603/19,junlili,carhe,Minor,Closed,Fixed,17.12.2019 12:55,17.12.2019 19:09,,,,,
OSSSUP-86815,1878285,,Other,Scratch Installation is faling in CLAB2213,w2yu,rajepath,Minor,Closed,Fixed,17.12.2019 0:19,18.12.2019 13:05,,,,,
OSSSUP-86814,1878202,,Unplanned SW upgrade,CLAB483 - upgrade of FP635 to P8 on NA19 P8,magrocho,matyszok,Minor,Closed,Fixed,16.12.2019 22:21,17.12.2019 5:59,,VP(VerificationPipeline),,,
OSSSUP-86813,1878197,,Integration problem,Integration of  OMS1001 to NetAct clab1345 is failed,aprzybyl,mtrandaf,Minor,Resolved,Fixed,16.12.2019 22:18,11.5.2020 14:43,,,,,
OSSSUP-86812,1878169,,Unplanned SW upgrade,CLAB1594 - installation of FP659 P8 on NA19 P8,jatomczy,matyszok,Minor,Resolved,Fixed,16.12.2019 21:54,17.12.2019 14:53,,VP(VerificationPipeline),,,
OSSSUP-86811,1878166,,Other,Scratch installation in Clab461 is failing,x30zhang,prasads,Minor,Closed,Fixed,16.12.2019 21:53,18.12.2019 14:39,,,,,
OSSSUP-86810,1878042,,Scratch installation,Trunk build(netact/product/99.19.12.0.104) installation on CLAB914,w2yu,udayagir,Minor,Closed,Fixed,16.12.2019 20:33,18.12.2019 9:15,,,,,
OSSSUP-86809,1877868,,Configuration changes,[CLAB512] Upgrade with cm_n19sp/adaptations/19.5.0.650,x30zhang,hojenska,Minor,Closed,Fixed,16.12.2019 18:31,17.12.2019 16:24,,,,,
OSSSUP-86808,1877808,,Integration problem,Sprintlab470 BTSMED-1 redeploy,magrocho,kgolabek,Minor,Closed,Fixed,16.12.2019 18:09,17.12.2019 16:49,,,,,
OSSSUP-86807,1877801,,Other,NetAct clab769 needs FP635 installation on top of SP1911,jatomczy,mtrandaf,Minor,Closed,Fixed,16.12.2019 18:06,11.5.2020 14:42,,VP(VerificationPipeline),,,
OSSSUP-86806,1877592,,Unplanned SW upgrade,CLAB1594 - L19 and L18A adaptation deployment on NA19 P8,jatomczy,matyszok,Minor,Closed,Fixed,16.12.2019 16:26,16.12.2019 18:52,,,,,
OSSSUP-86805,1877473,,Question,[CLAB1007] Q3 mediation upgrade failed,junlili,kuzhang,Minor,Closed,Fixed,16.12.2019 15:34,17.12.2019 9:39,,,,,
OSSSUP-86804,1877250,,Integration request,Please take snapshot for clab120,w2yu,zhuchen,Minor,Closed,Fixed,16.12.2019 14:34,16.12.2019 15:02,,,,,
OSSSUP-86803,1876930,,Unplanned SW upgrade,Scratch install entity lab CLAB813 to build 'netact/product/99.19.12.0.92',x30zhang,x30zhang,Minor,Closed,Fixed,16.12.2019 9:44,16.12.2019 17:10,,,,,
OSSSUP-86802,1876929,,Unplanned SW upgrade,Upgrade CLAB3271 to SP1912 build 'netact19_sp_stabi/product/19.0.12.46',x30zhang,x30zhang,Minor,Closed,Fixed,16.12.2019 9:42,17.12.2019 9:22,,,,,
OSSSUP-86801,1876868,,Question,[CLAB512] Upgrade with netact19_sp,w2yu,kimak,Minor,Closed,Fixed,16.12.2019 6:51,16.12.2019 17:04,,,,,
OSSSUP-86800,1875891,,Scratch installation,[clab1169] Please install NetAct 19 + SP1911,magrocho,tlisowsk,Major,Closed,Fixed,13.12.2019 22:19,17.12.2019 20:49,,,,,
OSSSUP-86799,1875839,,Unplanned SW upgrade,CLAB1594 - instalaltion FP661 P7.1 on NA19 P8,magrocho,matyszok,Minor,Closed,Fixed,13.12.2019 21:28,17.12.2019 14:49,,VP(VerificationPipeline),,,
OSSSUP-86798,1875795,,Unplanned SW upgrade,CLAB113 - upgrade FP635 to P8 on NA19 P8,jatomczy,matyszok,Minor,Closed,Fixed,13.12.2019 20:51,17.12.2019 14:49,,VP(VerificationPipeline),,,
OSSSUP-86797,1875751,,Unplanned SW upgrade,CLAB1594 - FP605 installation on NA19 P8,jatomczy,matyszok,Minor,Closed,Fixed,13.12.2019 20:03,17.12.2019 14:50,,VP(VerificationPipeline),,,
OSSSUP-86796,1875643,,Unplanned SW upgrade,CLAB483 - installation of FP659 ,jatomczy,parnold,Minor,Closed,Fixed,13.12.2019 18:27,17.12.2019 14:50,,VP(VerificationPipeline),,,
OSSSUP-86795,1875626,,Configuration changes,Revert to lab to the first snapshot taken on 2019-11-27 12:04:09 centos 7.6,jatomczy,schincho,Minor,Closed,Fixed,13.12.2019 18:06,13.12.2019 18:45,,,,,
OSSSUP-86794,1875289,,Scratch installation,Sprintlab323: NA19P8+SP1909P8 installation,w2yu,z001upxa,Minor,Closed,Fixed,13.12.2019 15:54,10.2.2020 11:59,,VP(VerificationPipeline),,,
OSSSUP-86793,1875277,,Unplanned SW upgrade,Sprintlab384: SP1909 upgrade installation,junlili,z001upxa,Minor,Closed,Fixed,13.12.2019 15:46,10.2.2020 11:59,,VP(VerificationPipeline),,,
OSSSUP-86792,1875276,,Unplanned SW upgrade,CLAB1594 - installation of FP635 P8 on NA19 P8,magrocho,matyszok,Minor,Closed,Fixed,13.12.2019 15:46,13.12.2019 17:40,,,,,
OSSSUP-86791,1875244,,Scratch installation,[sprintlab379] Install to latest Trunk QL4,aprzybyl,jiaozou,Minor,Closed,Fixed,13.12.2019 15:22,18.12.2019 11:13,,,,,
OSSSUP-86790,1875207,,Configuration changes,DCSA one more Snapshot of lab CLAB2454node01,w2yu,schincho,Minor,Closed,Fixed,13.12.2019 14:57,13.12.2019 15:02,,,,,
OSSSUP-86789,1875132,,Scratch installation,Please install SP1911 on CLAB3317,w2yu,kadu,Minor,Closed,Fixed,13.12.2019 14:12,16.12.2019 9:01,,,,,
OSSSUP-86788,1875105,,Other,Scratch install on CLAB1187 is failing.,w2yu,kumarmk,Minor,Closed,Fixed,13.12.2019 13:56,16.12.2019 8:59,,,,,
OSSSUP-86787,1875096,,Question,CLAB3386 need be scratched with NA18A P8+SP04 P8 with ALS mode and IPV6,w2yu,shenfeng,Minor,Closed,Fixed,13.12.2019 13:50,16.12.2019 9:11,,,,,
OSSSUP-86786,1875026,,Other,Scratch installation in Clab461 is failing,w2yu,prasads,Minor,Closed,Fixed,13.12.2019 13:09,16.12.2019 8:57,,,,,
OSSSUP-86785,1874974,,Unplanned SW upgrade,"DCSA Snapshot of lab clab1598node01,clab1465node01,clab1529node01",w2yu,pogr,Minor,Closed,Fixed,13.12.2019 11:08,13.12.2019 13:10,,,,,
OSSSUP-86784,1874681,,Unplanned SW upgrade,Spiintlab085 customer like  upgrade with FP659 (SRAN20A support),jatomczy,parnold,Minor,Closed,Fixed,13.12.2019 0:23,17.12.2019 14:50,,VP(VerificationPipeline),,,
OSSSUP-86783,1874680,,Unplanned SW upgrade,CLAB1372 upgrade with FP659 (SRAN20A support),jatomczy,parnold,Minor,Resolved,Fixed,13.12.2019 0:23,17.12.2019 14:50,,VP(VerificationPipeline),,,
OSSSUP-86782,1874679,,Unplanned SW upgrade,CLAB1347 upgrade with FP659 (SRAN20A support),jatomczy,parnold,Minor,Closed,Fixed,13.12.2019 0:23,17.12.2019 14:51,,VP(VerificationPipeline),,,
OSSSUP-86781,1874678,,Unplanned SW upgrade,CLAB1292 upgrade with FP659 (SRAN20A support),jatomczy,parnold,Minor,Resolved,Fixed,13.12.2019 0:23,13.12.2019 16:56,,,,,
OSSSUP-86780,1874625,,Other,Scratch Installation is faling in CLAB2213,w2yu,rajepath,Minor,Closed,Fixed,12.12.2019 22:47,16.12.2019 8:54,,,,,
OSSSUP-86779,1874463,,Unplanned SW upgrade,CLAB483 - installation of FP659 v20191128T105041 on NA19 P8,jatomczy,matyszok,Minor,Closed,Fixed,12.12.2019 20:21,17.12.2019 14:51,,VP(VerificationPipeline),,,
OSSSUP-86778,1874421,,Other,sdv file required to run JRE8u231 tests on Sprintlab471,jatomczy,bhandage,Minor,Closed,Won't Fix,12.12.2019 19:25,16.12.2019 16:02,,,,,
OSSSUP-86777,1874402,,Scratch installation,Request to scratch install sprintlab462,aprzybyl,abhisn,Minor,Resolved,Fixed,12.12.2019 19:05,30.12.2019 17:22,,,,,
OSSSUP-86776,1874373,,Configuration problem / Broken lab,VSP0009 fail message on power off action and revert doesn't work,magrocho,skarba,Minor,Closed,Fixed,12.12.2019 18:39,12.12.2019 22:19,,,,,
OSSSUP-86775,1874359,,Configuration problem / Broken lab,Missing licence on lab after scratch,jatomczy,katafias,Minor,Closed,Fixed,12.12.2019 18:22,12.12.2019 19:03,,,,,
OSSSUP-86774,1874273,,Question,Request to provide root credentials to run JRE8u231 tests on Sprintlab471,jatomczy,bhandage,Minor,Closed,Fixed,12.12.2019 17:32,12.12.2019 19:03,,,,,
OSSSUP-86773,1874219,,Unplanned SW upgrade,CLAB1594 - instalation of SP1911 P8 on NA19 P8,magrocho,matyszok,Minor,Closed,Fixed,12.12.2019 17:14,13.12.2019 15:17,,,,,
OSSSUP-86772,1874169,,Other,CLAB595 lab UI page is not accessible,magrocho,vkumars,Minor,Closed,Fixed,12.12.2019 16:56,17.12.2019 14:49,,,,,
OSSSUP-86771,1874077,,Other,Scratch Installation is faling in CLAB2300 ,w2yu,rajepath,Minor,Closed,Fixed,12.12.2019 16:14,13.12.2019 9:16,,,,,
OSSSUP-86770,1874075,,Other,CLAB1594 - revert to snap on NA19 P8,junlili,matyszok,Minor,Closed,Fixed,12.12.2019 16:13,12.12.2019 17:08,,,,,
OSSSUP-86769,1873930,,Other,Scratch installation on CLAB2335 is failing with 19SP product build,w2yu,vkumars,Minor,Closed,Fixed,12.12.2019 14:53,13.12.2019 10:48,,,,,
OSSSUP-86768,1873835,,Scratch installation,Sprintlab384: NA19 P8 installation,aprzybyl,z001upxa,Minor,Resolved,Fixed,12.12.2019 13:49,13.12.2019 15:44,,,,,
OSSSUP-86767,1873779,,Other,Scratch installation on CLAB1748 is failing with 19SP product build,w2yu,vkumars,Minor,Closed,Rejected,12.12.2019 13:11,12.12.2019 13:54,,,,,
OSSSUP-86766,1873777,,Question,CloudLab1901 upgrade failed,w2yu,jiafu,Minor,Closed,Fixed,12.12.2019 13:09,16.12.2019 8:53,,,,,
OSSSUP-86765,1873755,,Configuration problem / Broken lab,CloudLab3354 SP upgrade failure,w2yu,shasubra,Minor,Closed,Fixed,12.12.2019 12:34,13.12.2019 9:12,,,,,
OSSSUP-86764,1873304,,Scratch installation,SP2001 latest QL4 upgrade request,w2yu,udayagir,Minor,Closed,Fixed,11.12.2019 23:12,12.12.2019 15:46,,,,,
OSSSUP-86763,1873301,,Scratch installation,SP2001 latest QL4 upgrade request,junlili,udayagir,Minor,Closed,Closed,11.12.2019 23:09,18.12.2019 10:54,,,,,
OSSSUP-86762,1873295,,Configuration problem / Broken lab,RNC-36/WBTS-224 is not connected or busy,jatomczy,gleontiu,Minor,Closed,Won't Fix,11.12.2019 23:01,11.5.2020 14:04,,,,,
OSSSUP-86761,1872906,,Scratch installation,scratch and install NetAct19 SP1908 in CLAB202,magrocho,sudhkuma,Minor,Closed,Fixed,11.12.2019 17:42,12.12.2019 17:17,,,,,
OSSSUP-86760,1872714,,Other,CLAB333 - OVA deployment on BTSMED-1 when connected to CLAB483,jatomczy,matyszok,Minor,Closed,Fixed,11.12.2019 16:18,11.12.2019 18:00,,,,,
OSSSUP-86759,1872583,,Scratch installation,clab729 scratch install failed for NA19ASP1912,junlili,bezheng,Minor,Closed,Fixed,11.12.2019 15:18,17.12.2019 10:42,,,,,
OSSSUP-86758,1872543,,Other,please upgrade lab CloudLab3351 to NetAct 19 SP1912,junlili,a34gupta,Minor,Closed,Fixed,11.12.2019 14:50,12.12.2019 9:10,,,,,
OSSSUP-86757,1872426,,Scratch installation,[CLAB3405] upgrade to netact18a/SP603/19 ,w2yu,lshi,Minor,Closed,Fixed,11.12.2019 13:53,30.12.2019 14:14,,,,,
OSSSUP-86756,1872301,,Scratch installation,please help install CLAB1723 with corresponding version,w2yu,nasun,Minor,Closed,Fixed,11.12.2019 11:26,12.12.2019 8:59,,,,,
OSSSUP-86755,1872293,,Question,Please help to upgrade VSP0048 to SP1904,k1n,carhe,Minor,Resolved,Resolved,11.12.2019 11:16,13.12.2019 14:34,,,,,
OSSSUP-86754,1872166,,Scratch installation,Scratch install entity lab CLAB1564 to build 'netact/product/99.19.12.0.68',x30zhang,x30zhang,Minor,Closed,Fixed,11.12.2019 9:44,11.12.2019 16:52,,,,,
OSSSUP-86753,1872164,,Unplanned SW upgrade,Revert and upgrade CLAB1040 to SP1912 build 'netact19_sp_stabi/product/19.0.12.31',x30zhang,x30zhang,Minor,Closed,Fixed,11.12.2019 9:43,12.12.2019 9:30,,,,,
OSSSUP-86752,1872141,,Question,clab3375 install failed,junlili,kuni,Minor,Closed,Fixed,11.12.2019 9:16,12.12.2019 9:09,,,,,
OSSSUP-86751,1871868,,Other,SP upgrade in CLAB689,w2yu,sudhkuma,Minor,Closed,Fixed,10.12.2019 21:15,12.12.2019 10:22,,,,,
OSSSUP-86750,1871832,,Unplanned SW upgrade,[VSP0011] Upgrade VSP0011 to NETACT SP1912 - 19.0.12.25,magrocho,amerce,Minor,Closed,Fixed,10.12.2019 20:45,11.12.2019 23:30,,,,,
OSSSUP-86749,1871831,,Question,Integration of SBTS to Netact failed,aprzybyl,sverlan,Minor,Resolved,Fixed,10.12.2019 20:44,11.12.2019 17:59,,,,,
OSSSUP-86748,1871830,,Configuration changes,Please install licenses / check if working properly on sprintlab383,aprzybyl,szeremet,Minor,Resolved,Fixed,10.12.2019 20:43,10.12.2019 20:47,,,,,
OSSSUP-86747,1871809,,Other,Install NA19 P8 product build in VSP0014,x30zhang,pjailani,Minor,Closed,Fixed,10.12.2019 20:10,17.12.2019 9:25,,,,,
OSSSUP-86746,1871803,,Other,Please take snapshot and after that upgrade VSP0114 lab to NetAct19 SP1912,x30zhang,a34gupta,Minor,Closed,Won't Fix,10.12.2019 20:04,10.2.2020 11:58,,VP(VerificationPipeline),,,
OSSSUP-86745,1871689,,Scratch installation,SP2001 latest QL4 upgrade request,junlili,udayagir,Minor,Closed,Fixed,10.12.2019 18:42,12.12.2019 10:21,,,,,
OSSSUP-86744,1871527,,Unplanned SW upgrade, Upgrade to NA18AMP1 build,k1n,ritpaul,Minor,Resolved,Resolved,10.12.2019 17:14,13.12.2019 13:32,,,,,
OSSSUP-86743,1871517,,Question,Node Manager node clab437 need be hanged below CLAB3386,junlili,shenfeng,Minor,Closed,Fixed,10.12.2019 17:09,11.12.2019 10:23,,,,,
OSSSUP-86742,1871367,,Scratch installation,[CLAB1007] Please help to scratch install clab1007,junlili,kuzhang,Minor,Closed,Fixed,10.12.2019 16:06,11.12.2019 9:01,,,,,
OSSSUP-86741,1871349,,Scratch installation,CLAB2266 - ALS scratch with installation of NA19 P8 + post tasks,aprzybyl,matyszok,Critical,Resolved,Fixed,10.12.2019 16:01,17.12.2019 16:57,,,,,
OSSSUP-86740,1870909,,Question,CLAB737 need upgrade netact/SP615/38 failed,junlili,shenfeng,Minor,Closed,Fixed,10.12.2019 10:57,10.12.2019 13:05,,,,,
OSSSUP-86739,1870837,,Unplanned SW upgrade,[clab3405] Single_Upgrade_Installation failed from 18.2.0.472 to netact18a_sp_stabi/product/18.2.16.117,w2yu,trali,Minor,Closed,Fixed,10.12.2019 9:53,10.12.2019 16:57,,,,,
OSSSUP-86738,1870662,,Other,Scratch Installation is faling in CloudLab3343,junlili,rajepath,Minor,Closed,Fixed,10.12.2019 0:59,11.12.2019 15:21,,,,,
OSSSUP-86737,1870555,,Unplanned SW upgrade,CLAB1594 - installation of FP659 P8 on NA19 P8,jatomczy,matyszok,Minor,Closed,Fixed,9.12.2019 21:51,17.12.2019 14:51,,VP(VerificationPipeline),,,
OSSSUP-86736,1870524,,Unplanned SW upgrade,CLAB694 - installation of SP1911 P8 on NA19 P8,jatomczy,matyszok,Minor,Closed,Fixed,9.12.2019 21:42,19.12.2019 16:52,,,,,
OSSSUP-86735,1870520,,Unplanned SW upgrade,CLAB483 - installation of SP1911 P8 on NA19 P8,magrocho,matyszok,Minor,Closed,Fixed,9.12.2019 21:39,11.12.2019 14:22,,,,,
